{
  "$schema": "urn:golfergeek:schema:apple-divinr-integration-profile:v0.2",
  "profileId": "urn:golfergeek:profile:apple-divinr-commerce:v0.2",
  "status": "frozen-v0.2",
  "upstream": {
    "a2a": {
      "version": "1.0.0",
      "git": "https://github.com/a2aproject/A2A.git",
      "commit": "173695755607e884aa9acf8ce4feed90e32727a1"
    },
    "ap2": {
      "version": "0.2.0",
      "git": "https://github.com/google-agentic-commerce/AP2.git",
      "commit": "b4587ac1d055888a73b4b21750973cffba961793",
      "schemaAliases": {
        "https://ap2-protocol.org/schemas/types/receipt_status.json": "https://ap2-protocol.org/schemas/receipt-status.json"
      }
    },
    "x402": {
      "coreVersion": 2,
      "git": "https://github.com/x402-foundation/x402.git",
      "commit": "21a2e489c7ba17c2b04e4cd9ea7015da1cb4aa99",
      "conformanceClaim": "x402-v2-object-semantics-with-project-owned-a2a-lightning-binding"
    }
  },
  "identifiers": {
    "merchantId": "divinr",
    "oauthClientId": "apple-assistant-native-v1",
    "a2aExtensionUri": "urn:golfergeek:a2a:x402-lightning-regtest:v0.2",
    "constraintNamespace": "urn:golfergeek:agent-commerce:constraints:v0.2",
    "productCatalogId": "divinr.agent-services.demo.v2",
    "paymentNetwork": "urn:golfergeek:x402:lightning-regtest:v0.2",
    "paymentAsset": "BTC-REGTEST",
    "paymentUnit": "msat",
    "paymentMethod": "exact"
  },
  "publicEndpoints": {
    "origin": "https://divinr.ai",
    "agentCard": "https://divinr.ai/.well-known/agent-card.json",
    "oauthAuthorizationServerMetadata": "https://divinr.ai/.well-known/oauth-authorization-server",
    "oauthProtectedResourceMetadata": "https://divinr.ai/.well-known/oauth-protected-resource",
    "jwks": "https://divinr.ai/.well-known/jwks.json",
    "deviceAuthorization": "https://divinr.ai/oauth/device_authorization",
    "deviceVerification": "https://divinr.ai/connect/device",
    "token": "https://divinr.ai/oauth/token",
    "revocation": "https://divinr.ai/oauth/revoke",
    "a2a": "https://divinr.ai/a2a",
    "applePublicAgent": "https://agent.golfergeek.com/v1/public/messages",
    "appleTrustedAgent": "https://agent.golfergeek.com/v1/trusted/messages",
    "appleTrustedPush": "https://agent.golfergeek.com/v1/trusted/divinr/events"
  },
  "privateEndpoints": {
    "appleMacStudioTailscaleIpv4": "100.90.49.63",
    "appleMacStudioTailscaleHost": "gg-macstudio.tail126196.ts.net",
    "sparkTailscaleIpv4": "100.120.203.62",
    "sparkHost": "spark-51e5.tail126196.ts.net",
    "appleOwnerBaseUrl": "https://gg-macstudio.tail126196.ts.net:7445/v1",
    "cloudflareOriginSocket": "unix:///var/run/apple-assistant/agent-ingress.sock",
    "payerBaseUrl": "https://spark-51e5.tail126196.ts.net:7443/v1",
    "payerDivinrVerifierBaseUrl": "https://127.0.0.1:7443/v1",
    "merchantBaseUrl": "https://127.0.0.1:7444/v1"
  },
  "interfaces": {
    "divinrPublic": {
      "GET /.well-known/agent-card.json": {"request": null, "response": "agentCardResponse", "charged": false},
      "GET /.well-known/oauth-authorization-server": {"request": null, "response": "oauthAuthorizationServerMetadata", "charged": false},
      "GET /.well-known/oauth-protected-resource": {"request": null, "response": "oauthProtectedResourceMetadata", "charged": false},
      "GET /.well-known/jwks.json": {"request": null, "response": "jwksResponse", "charged": false},
      "POST /oauth/device_authorization": {"request": "deviceAuthorizationRequest", "response": "deviceAuthorizationResponse", "charged": false},
      "POST /oauth/token": {"request": "tokenRequest", "response": "tokenResponse", "charged": false},
      "POST /oauth/revoke": {"request": "revocationRequest", "response": "emptyResponse", "charged": false},
      "POST /a2a": {"request": "A2A-1.0 JSON-RPC request plus project metadata", "response": "A2A-1.0 JSON-RPC response plus project metadata", "charged": "SendMessage business payment saga only; charge commits at independently verified settlement before service release"}
    },
    "appleIngress": {
      "POST /v1/public/messages": {"request": "inboundAgentMessage", "response": "ingressAcknowledgment"},
      "POST /v1/trusted/messages": {"request": "inboundAgentMessage", "response": "ingressAcknowledgment"},
      "POST /v1/trusted/divinr/events": {"request": "pushEvent", "response": "pushAcknowledgment"}
    },
    "sparkPayer": {
      "GET /health": {"request": null, "response": "healthResponse"},
      "GET /balance": {"request": null, "response": "balanceResponse"},
      "GET /jwks": {"request": null, "response": "jwksResponse"},
      "POST /payments/prepare": {"request": "payerPrepareRequest", "response": "payerPrepareResponse"},
      "POST /payments/{id}/execute": {"request": "payerExecuteRequest", "response": "payerPaymentStatus"},
      "GET /payments/{id}": {"request": null, "response": "payerPaymentStatus"},
      "GET /payments/{id}/receipt": {"request": null, "response": "signedReceiptResponse"},
      "POST /payments/{id}/reconcile": {"request": "payerReconcileRequest", "response": "payerPaymentStatus"},
      "POST /refunds/invoices": {"request": "refundInvoiceRequest", "response": "refundInvoiceResponse"},
      "GET /refunds/{refundId}": {"request": null, "response": "refundStatusResponse"}
    },
    "sparkPayerDivinrVerifier": {
      "GET /jwks": {"request": null, "response": "jwksResponse"},
      "GET /payments/{id}": {"request": null, "response": "payerPaymentStatus"},
      "GET /payments/{id}/receipt": {"request": null, "response": "signedReceiptResponse"}
    },
    "sparkMerchant": {
      "GET /health": {"request": null, "response": "healthResponse"},
      "GET /jwks": {"request": null, "response": "jwksResponse"},
      "POST /invoices": {"request": "merchantInvoiceRequest", "response": "merchantInvoiceResponse"},
      "GET /invoices/{id}": {"request": null, "response": "merchantInvoiceStatus"},
      "GET /settlements/{paymentHash}": {"request": null, "response": "merchantSettlementStatus"},
      "POST /refund-invoices/{originalPaymentId}/pay": {"request": "refundPayRequest", "response": "merchantRefundPaymentStatus"},
      "POST /release-authorizations/{id}/consume": {"request": "releaseAuthorizationConsumeRequest", "response": "releaseAuthorizationConsumeResponse"}
    }
  },
  "appleIngress": {
    "cloudflareRoutes": [
      "/v1/public/messages",
      "/v1/trusted/messages",
      "/v1/trusted/divinr/events"
    ],
    "cloudflareCatchAll": "http_status:404",
    "public": {
      "authentication": "none",
      "maximumBodyBytes": 65536,
      "maximumRequestsPerMinutePerSource": 10,
      "maximumRequestsPerMinuteGlobal": 600,
      "allowedCapabilities": ["message", "contact_request"],
      "hermesProfile": "external-public-restricted"
    },
    "trusted": {
      "authentication": "RFC9421-registered-principal-key",
      "algorithm": "ecdsa-p256-sha256",
      "signatureComponents": ["@method", "@target-uri", "content-digest", "content-type", "x-agent-id", "x-request-id", "x-issued-at"],
      "maximumBodyBytes": 262144,
      "maximumRequestsPerMinutePerPrincipal": 60,
      "maximumRequestsPerMinuteGlobal": 600,
      "maximumClockSkewSeconds": 60,
      "replayLifetimeSeconds": 300,
      "allowedCapabilities": ["message", "contact_request", "task_proposal"],
      "hermesProfile": "external-trusted-restricted"
    },
    "owner": {
      "authentication": "tailscale-acl-plus-mtls",
      "port": 7445,
      "serverSpiffeId": "spiffe://golfergeek.local/apple-assistant/owner-control",
      "clientSpiffePrefix": "spiffe://golfergeek.local/apple-assistant/owner-device/",
      "maximumBodyBytes": 1048576,
      "maximumRequestsPerMinutePerDevice": 120,
      "routes": [
        "POST /assistant/messages",
        "POST /interactions/{interactionId}/responses",
        "GET /conversations/{conversationId}/events"
      ],
      "hermesProfile": "owner"
    }
  },
  "a2a": {
    "protocolBinding": "JSONRPC",
    "protocolVersionHeader": "1.0",
    "endpoint": "/a2a",
    "contentType": "application/json",
    "extensionHeader": "A2A-Extensions",
    "agentCardExtensionRequired": false,
    "agentCardExtensionParams": {
      "profile": "urn:golfergeek:profile:apple-divinr-commerce:v0.2",
      "requiredForSkills": ["general_updates", "personal_updates", "tournaments_list", "tournament_context", "analysis_request", "tournament_join", "tournament_trade"],
      "skillSchemas": {
        "general_updates": {"input": "urn:golfergeek:schema:apple-divinr-integration:v0.2#/$defs/updatesRequest", "output": "urn:golfergeek:schema:apple-divinr-integration:v0.2#/$defs/updatesResult"},
        "personal_updates": {"input": "urn:golfergeek:schema:apple-divinr-integration:v0.2#/$defs/updatesRequest", "output": "urn:golfergeek:schema:apple-divinr-integration:v0.2#/$defs/updatesResult"},
        "tournaments_list": {"input": "urn:golfergeek:schema:apple-divinr-integration:v0.2#/$defs/tournamentsListRequest", "output": "urn:golfergeek:schema:apple-divinr-integration:v0.2#/$defs/tournamentsListResult"},
        "tournament_context": {"input": "urn:golfergeek:schema:apple-divinr-integration:v0.2#/$defs/tournamentContextRequest", "output": "urn:golfergeek:schema:apple-divinr-integration:v0.2#/$defs/tournamentContextResult"},
        "analysis_request": {"input": "urn:golfergeek:schema:apple-divinr-integration:v0.2#/$defs/analysisRequest", "output": "urn:golfergeek:schema:apple-divinr-integration:v0.2#/$defs/analysisResult"},
        "tournament_join": {"input": "urn:golfergeek:schema:apple-divinr-integration:v0.2#/$defs/tournamentJoinRequest", "output": "urn:golfergeek:schema:apple-divinr-integration:v0.2#/$defs/tournamentJoinResult"},
        "tournament_trade": {"input": "urn:golfergeek:schema:apple-divinr-integration:v0.2#/$defs/tournamentTradeRequest", "output": "urn:golfergeek:schema:apple-divinr-integration:v0.2#/$defs/tournamentTradeResult"}
      }
    },